{
  "$schema": "http://json-schema.org/draft-07/schema#",
  "$id": "study-app/exam.schema.json",
  "title": "Final Exam",
  "description": "Examen final de una certificación — Study Content Schema v1",
  "type": "object",
  "required": ["schemaVersion", "type", "certificationId", "language", "exam", "questions"],
  "additionalProperties": false,
  "properties": {
    "schemaVersion": {
      "type": "string",
      "pattern": "^\\d+\\.\\d+$"
    },
    "type": {
      "type": "string",
      "const": "exam"
    },
    "certificationId": {
      "type": "string",
      "pattern": "^[a-z0-9-]+$"
    },
    "language": {
      "type": "string",
      "pattern": "^[a-z]{2}(-[A-Z]{2})?$",
      "description": "BCP 47. Ej: es-MX, en-US"
    },
    "exam": {
      "type": "object",
      "required": ["id", "name", "passingScore"],
      "additionalProperties": false,
      "properties": {
        "id": {
          "type": "string",
          "pattern": "^[a-z0-9-]+$"
        },
        "name": {
          "type": "string",
          "minLength": 1,
          "maxLength": 100
        },
        "description": {
          "type": "string",
          "maxLength": 500
        },
        "passingScore": {
          "type": "integer",
          "minimum": 1,
          "maximum": 100
        },
        "timeLimit": {
          "type": "integer",
          "minimum": 1,
          "description": "Tiempo límite en minutos (opcional)"
        },
        "shuffleQuestions": {
          "type": "boolean",
          "default": true
        },
        "shuffleOptions": {
          "type": "boolean",
          "default": true
        }
      }
    },
    "questions": {
      "type": "array",
      "minItems": 1,
      "items": {
        "type": "object",
        "required": ["id", "type", "question", "options", "correctAnswers"],
        "additionalProperties": false,
        "properties": {
          "id": {
            "type": "string",
            "pattern": "^[a-z0-9-]+-q\\d{3,}$"
          },
          "type": {
            "type": "string",
            "enum": ["single-choice", "multiple-choice", "true-false"]
          },
          "moduleId": {
            "type": "string",
            "pattern": "^[a-z0-9-]+$",
            "description": "Módulo al que pertenece la pregunta (para reportar áreas a reforzar)"
          },
          "question": {
            "type": "string",
            "minLength": 1,
            "maxLength": 1000
          },
          "options": {
            "type": "array",
            "minItems": 2,
            "maxItems": 6,
            "items": {
              "type": "object",
              "required": ["id", "text"],
              "additionalProperties": false,
              "properties": {
                "id": { "type": "string", "minLength": 1 },
                "text": { "type": "string", "minLength": 1, "maxLength": 500 }
              }
            }
          },
          "correctAnswers": {
            "type": "array",
            "minItems": 1,
            "items": { "type": "string" }
          },
          "explanation": {
            "type": "string",
            "maxLength": 2000
          },
          "tags": {
            "type": "array",
            "items": {
              "type": "string",
              "pattern": "^[a-z0-9-]+$"
            }
          }
        }
      }
    }
  }
}
